Index,Word,Romaji,Meaning,Page Link,Page Number,Detailed Info
515,なるほど,naruhodo,An adverb indicating that the speaker/writer afﬁrms the correctness of something he/she has heard/read/observed.Indeed; it is true ~ (but); really; I see,entries/516.html,A. 359,"{'Explanation': 'No explanation available', 'Example Sentences': [('パリはきれいだと聞いていたが、なるほどその芸術性には舌を巻いた。', 'I had heard that Paris was a beautiful city, and (literally:  but) indeed I was astounded by its artistry.'), ('なるほど、日本の官僚はいろいろと批判されているが、戦後の日本の復興は彼らに負うところが多い。', ""It is true that Japanese bureaucrats are criticized in various  ways, but we owe them for much of Japan's post-war recovery.""), ('A:文化って、宗教のように倫理的な決まりが多いですね。B:なるほどね。', 'A: Culture, like religion, has a lot of ethical rules. / B: I  see.'), ('この大学のことは大学案内で読んではいたが、実際に来てみると、なるほど、学生たちはずばらしい教育を受けているようだ。', 'I had read about this college in a college guide, but by  actually coming here myself I can see the students really seem to be getting a  great education.'), ('この辺りでは菜の花畑が4月中旬ごろ特にきれいだと聞いていたが、なるほど見事である。', ""I had heard that the ﬁelds of rape blossoms around here are  particularly beautiful around mid-April, and now that I've seen them myself, I  have to say that they are indeed impressive.""), ('本日、川上弘美『椰子・椰子』を読了。なるほど面白い本だ。', 'Today I finished reading Hiromi Kawakami\'s ""Yashi, Yashi (Palm,  Palm)."" It\'s indeed an interesting book.'), ('なるほど、これだけの規模のテロが起きると人々は恐怖に捕われるけれど、自分でコントロールできないことをくよくよ心配しても仕方がないだろう。', ""It's true people are caught by fear when terrorism of this  magnitude occurs, but it is no use worrying too much about what you cannot  control.""), ('なるほど日本の文化とドイツの文化は違っている点があるが、実は共通点の方が多いようだ。', 'Indeed there are differences between Japanese culture and  German culture, but actually it seems they have more similarities than  differences.'), ('A:実は僕には好きな人がいるんですが、勇気がなくて告白できないんです。\u3000B: なるほど。でも、それは自分に対する自信が足りないからじゃないの？', ""A: To tell you the truth, there's someone I love, but I don't  have the courage to tell her. B: I see exactly what you mean. It's because you  don't have enough self-conﬁdence.""), ('A:この使い捨てカメラって、写真を撮りたい時簡単に買えて、撮ったらそのままカメラ屋に現像に出せるのが魅力なんだ。面倒なフィルムの出し入れもないし。B:なるほど。', ""A: The attractive feature of this disposable camera is that you  can buy one whenever you want to take a picture, and when you are done you can  take it as is to a camera shop for developing. You don't need to bother putting  film in and taking it out. B: Oh, I see."")], 'Image Notes': 'https://postautistic.github.io/img/Advancedなるほど.png'}"
516,なしに,nashini,An adverbial phrase meaning “without (doing) something”.Without,entries/517.html,A. 362,"{'Explanation': 'No explanation available', 'Example Sentences': [('料金は予告（すること）なしに変更する場合がございます。', 'The fee may (literally: will sometimes) change without prior  notice.'), ('友達が何の連絡もなしにいきなり訪ねてきた。', 'My friend suddenly dropped by without contacting me ﬁrst.'), ('日本語の授業は手続き（すること）なしには聴講できません。', 'You cannot audit a Japanese class without going through the  formal (registration) process.'), ('ソフトウエアの不正コピーには、許諾なしに複製されたソフトウエアや、偽造されたソフトウエアが含まれている。', 'Illegal copies of software include software copied without  permission and forged software.'), ('お客様の同意なしに、第三者に個人情報を転送することはありません。', ""We will never transfer private information to a third party  without the customer's consent.""), ('男たちは何の許可もなしに事務所のコンピュータを勝手に使っていた。', 'The men were using the ofﬁce computers without permission.'), ('キリスト教を理解することなしにヨーロッパの文化や社会を理解することは難しいと言われています。', 'They say it is difficult to understand  European culture and society without understanding Christianity.'), ('この実験の最初の10年は何の成果も得ることなしに過ぎてしまった。', 'The ﬁrst 10 years of this experiment passed, and we had not  obtained a result.'), ('コンピュータと通信技術が飛躍的に発展するにつれ、社会生活が大きく変化し、いまやコンピュータなしには我々の生活が成立しなくなりつつある。', 'With the rapid development of computers and communications  technology, society has seen great changes, to the point that it is becoming  harder to conduct our daily lives without computers.'), ('天気予報もテレビ中継も国際電話も、人工衛星の助けなしにはやっていけない時代になっている。', 'We are now in an age in which weather forecasting, live TV  broadcasting and international telephone calls are impossible without the help  of satellites.'), ('この掲示板では、営業目的の書き込みや著しく長い書き込みについては、断りなしに削除させていただくことがあります。', 'Comments that are for sales purposes or are extremely long may  be deleted from this bulletin board without prior notice.'), ('大事なことを何の話し合いもなしに決められて、私としては納得ができない。', 'They have made an important decision on an issue without any  discussion. I am dissatisﬁed.'), ('一切の政治権力なしに人々自由を実現することは、はたして可能なのだろうか。', ""I wonder if people's freedom can be realised without any  political power.""), ('人一倍照れ屋だった父は、酒なしには人と話もできなかった。', ""My father, who was twice as shy as other people, couldn't even  talk with people without drinking sake ﬁrst."")], 'Image Notes': 'https://postautistic.github.io/img/Advancedなしに.png'}"
517,なす,nasu,A verb that means “to cause something to happen”Do; perform; make; change; constitute,entries/518.html,A. 365,"{'Explanation': 'No explanation available', 'Example Sentences': [('災い（を）転じて福となす。', 'One can turn misfortune into a blessing. [proverb]'), ('比喩に関しては現在多くの研究がなされている。', 'A large amount of research is being done on metaphors now.'), ('人間というものは、悪をなす存在である。', 'Human beings exist in order to do evil.'), ('民主主義はアメリカ合衆国の基盤をなす思想である。', 'Democracy is the founding ideology (literally: the ideology  that constitutes the foundation) of the United States of America.'), ('顧客創造のためには自社製品の潜在利益を利益となす努力を払わなければならない。', ""We have to make the effort to turn our products' potential  proﬁt into (real) proﬁt in order to gain more customers.""), ('患者が入院時に病名や病状について理解していない場合は、必要に応じて適切な説明がなされるべきである。', 'If patients do not understand the name of their disease and its  symptoms at the time of hospitalization, they should be given an appropriate  explanation as needed.'), ('インターネットに関してこのような質問がなされる可能性は高い。', 'Such questions are likely to be asked regarding the Internet.'), ('善をなすのを急げ。悪から心を退けよ。', 'Hurry to do good. Turn your mind away from evil.'), ('権利の保護には最善の努力をなすことを目標にしている。', 'For the protection of our rights we aim at doing our very best.'), ('コンピュータサイエンスの基本をなす考え方は、様々な科学の分野で重要になってくると思われる。', 'It seems that the fundamental concepts (literally: the concepts  underlying the foundation) underlying computer science will become important in  various ﬁelds of science.'), ('情報リスクマネジメントという視点で、ビジネスの根幹をなす情報システムを評価・管理することが必須だ。', 'From the viewpoint of risk management, it is essential to  assess and manage the informational systems that constitute the core of a  business.')], 'Image Notes': 'https://postautistic.github.io/img/Advancedなす.png'}"
518,なぜか,nazeka,An adverb indicating that the speaker/writer doesn’t know the cause of/reason for somethingI don’t know why; without knowing why; for an unknown reason,entries/519.html,A. 370,"{'Explanation': 'No explanation available', 'Example Sentences': [('このところなぜか体の調子が悪い。', ""I don't know why, but I haven't felt well lately.""), ('ヨーロッパやアジアには受け入れられなかったSFが、なぜか日本には根づいた。', 'Science ﬁction, which did not catch on in Europe and Asia, took  root in Japan for some unknown reason.'), ('なぜか僕は日本語の難しさにはまってしまった。', 'For some reason, I got hooked by the difﬁculty of Japanese  language.'), ('最近私が住んでいる町ではなぜか古本屋が増えている。', ""I don't know why, but lately the number of used bookstores (in  the town) where I live has grown.""), ('ログインの手順を教えて下さい。なぜかできなくなってしまったんです。', ""Please teach me how to log in. I don't know why, but I can't do  it anymore.""), ('自分の文化のリズムには、なぜか体が自然と反応し、踊りたくなる。', 'For some unknown reason, our bodies respond spontaneously to  our own cultural rhythms, and we feel like dancing!')], 'Image Notes': 'https://postautistic.github.io/img/Advancedなぜか.png'}"
519,なぜなら（ば）～からだ,nazenarabakarada,A structure used to introduce a reason for the statement in the preceding sentence.The reason is that ~; because,entries/520.html,A. 371,"{'Explanation': 'No explanation available', 'Example Sentences': [('彼はみんなに好かれている。なぜなら（ば）、誰にでも親切だからだ。', 'Everybody likes him. The reason is that he is kind to  everybody.'), ('私は自分が好きです。なぜならば、今を自由に生きているからです。', 'I like myself. The reason is that I am living freely in the  moment.'), ('ゲームにおいて最も重要な要素は、目的です。なぜならば、ゲームは本能ではなく理性で行われるものだからです。', 'The most important element of a game is the objective. This is  because games are played not by instinct but by reason.'), ('外国語学習者は物事を考える時、自分の母語で考える。なぜならば、目標言語では考えがまとめられないからだ。', 'People who are learning a foreign language think in their  mother tongue (literally: when they think). The reason is that they cannot  think coherently in the target language.'), ('変化を遂げない経営は当然効率が悪くなります。なぜならば顧客も競合他社も常に変化しているからです。', ""Management that doesn't change will become ineffective, as a  matter of course. The reason is that both customers and competitors are always  changing.""), ('近現代の日本が本当に正しい道を歩んできたのかどうかは吟味に値する。なぜならば、その過程で日本が失ったものも多いからである。', 'Whether modern Japan has actually been taking the right path  should be examined. The reason is that Japan has lost many things during that  process.')], 'Image Notes': 'https://postautistic.github.io/img/Advancedなぜなら(ば)～からだ.png'}"
520,んばかり（に）,nbakarini,An adverbial phrase that is used when a situation looks as if someone were about to do something or as if something were about to occur literally or ﬁguratively.As if ~ were about to ~; almost,entries/521.html,A. 374,"{'Explanation': 'No explanation available', 'Example Sentences': [('犬は噛みつかんばかりに僕に向かってほえた。', 'The dog barked at me as if it were about to bite.'), ('どの演奏も若さと情熱あふれんばかりに満ちていた。', 'Every performance was ﬁlled with an overwhelming amount of  youth and passion (literally: as if youth and passion were about to overﬂow).'), ('時折、木の枝も折れんばかりの強風が吹いていた。', 'Occasionally the wind was blowing so hard it seemed the tree  branches would break.'), ('驚いて腰を抜かさんばかりだった。', 'I was so frightened that it seemed I was about to lose the use  of my legs (literally: to lose my lower back).'), ('その選手がシュートを決めた時、夜空に鳴り響く雷鳴をかき消さんばかりに、大歓声が競技場にとどろいた。', 'When the player scored a goal, a big shout of jubilation  reverberated throughout the arena, as though it would mufﬂe the rumble of  thunder in the night sky.'), ('樹高10メートルの梢から地面に届かんばかりに垂れ下がっている様子は、まさに流れ落ちる桜花の滝にふさわしい。', 'The way in which the cherry blossoms are hanging from the top  of the branch of the 10-meter tree, as if they were about to touch the ground,  is just worthy of being called a cherry blossom waterfall.'), ('「風の谷のナウシカ」を娘さんに薦められて見たお父さんは、涙を流さんばかりに感激した。', 'The father was so deeply moved by ""Nausicaa of the Valley of  the Wind,"" which his daughter recommended he watch, that he almost cried.'), ('演奏が終わるか終わらないかのうちに、この曲を知っているのは自分だと言わんばかりに拍手をする人もいます。', 'Some people begin applauding just as a performance is coming to  an end as if they were showing (literally: saying) how well they know the  piece.'), ('彼に別れたいと言われた時には、私は胸が張り裂けんばかりに苦しかった。', 'When he told me he wanted to break up, it was so painful I  thought my chest would burst.'), ('彼の死を聞いた時、彼女は気も狂わぬばかりに泣き叫んだ。', 'When she heard the news of his death, she screamed as if she  were crazy.'), ('上司から叱りつけられた山崎は土下座せぬばかりに平身低頭して謝った。', 'When his boss told him off, Yamazaki apologized, bowing to the  ground as if he were about to get down on his hands and knees.'), ('彼女はいつもこぼれんばかりの笑みをたたえている。', 'She is always smiling as if her smiles would overﬂow.'), ('引っ越しの時あまり重いものを持ったので、腕が肩から抜けんばかりだった。', 'During the move I carried such heavy stuff that it felt as if  my arms were about to fall out of their sockets (literally: come out from the  shoulders).')], 'Image Notes': 'https://postautistic.github.io/img/Advancedんばかり(に).png'}"
521,願う・願います,negaunegaimasu,A verb that expresses a polite request.Please; ask (for),entries/522.html,A. 377,"{'Explanation': 'No explanation available', 'Example Sentences': [('初めに、これだけは必ずお読み願います。', 'Please be sure to read at least this (part) first.'), ('禁煙にご協力願います。', 'Thank you for not smoking (literally: Please cooperate with us  in non-smoking).'), ('ご相談・ご意見・ご質問などがありましたら、下記へお知らせ願います。', 'If you have opinions, questions, or requests for advice (literally:  If there are things on which you want to consult us, your opinions and your  questions), please contact us at the following (address).'), ('当オンラインショップで商品をご注文いただく場合は、まず最初にカタログページからご希望の商品をお選び願います。', 'When you place an order for merchandise at this online shop,  please ﬁrst select the merchandise you want from the catalogue pages.'), ('この喫煙所は、入院しておられる患者さんの施設です。外来の方々は利用できませんのでご了承願います。', ""This smoking room is for hospitalized patients' use, so please  be advised (literally: understand) that outpatients are not allowed to use it.""), ('応募に際しては、以下の書類をEメールまたは郵便にてご送付願います。', 'When you apply, please send the following documents by e-mail  or regular mail.'), ('電車とホームの間が広く空いています。足元にご注意願います。', 'There is a wide gap between the train and the platform. Please  watch your step.'), ('学術研究を目的とする方以外の当研究所図書館の利用はご遠慮願います。', ""Please refrain from using this laboratory library for any  purpose other than academic research. (literally: Those whose purpose is other  than academic research are asked not to use this laboratory's library.)"")], 'Image Notes': 'https://postautistic.github.io/img/Advanced願う／願います.png'}"
522,にひきかえ,nihikikae,A phrase that indicates a sharp contrast.In contrast to ~; while; whereas,entries/523.html,A. 380,"{'Explanation': 'No explanation available', 'Example Sentences': [('几帳面な父にひきかえ、息子はだらしなかった。', 'The son, in contrast to his meticulous father, was slovenly.'), ('この大学は教育の質がとてもいいのにひきかえ、学内の設備が劣る。', 'While the quality of education at this college is excellent,  the quality of the campus facilities is inferior.'), ('昨日にひきかえ今朝は快晴です。', 'In contrast to yesterday, this morning is perfectly clear.'), ('姉は何事にも堅実なタイプなのにひきかえ、妹は奔放なタイプだ。', ""My older sister is the type who's steady in  any situation, while my younger sister is the free-wheeling  type.""), ('昨年が楽しい年だったのにひきかえ、今年は色々な意味で試練の年だった。', 'The last year was an enjoyable year, whereas this year has been  a year of trials for all sorts of reasons.'), ('16世紀のフランスでは、貴族の食事は贅沢だったのにひきかえ、市民の食事はとても貧しいものだった。', 'In France in the 16th century, the nobility ate extravagantly  while the common people ate very poorly.'), ('我々は「Aという国は、こんなにすばらしいことをしている。それにひきかえ日本は全く駄目だ」という話をずっと聞かされ続けたものだ。', '“Country A is doing this really fabulous thing. In contrast,  Japan is completely useless.” We have been hearing this kind of statement  (continuously) for a long time.'), ('ハーバードやMITの名前は日本で広く知られているのにひきかえ、残念ながら私が教えているプリンストンの名前はほとんど知られていない。', 'Names such as Harvard and MIT are well-known in Japan while, regrettably, the name (of the school) where I am teaching, Princeton, is hardly known.'), ('EUについては、経済問題はよく議論されてきたのにひきかえ、文化面の議論があまりなされてこなかった。', ""Although the EU's economic problems have been frequently debated, its cultural issues have hardly been discussed.""), ('このアパートは駅にとても近くて便利なのにひきかえ、部屋は狭く、家賃も高い。', 'While this apartment is very close to the station and convenient, the room is small and the rent is high.'), ('日本の大学は、入るのが難しいのにひきかえ、出るのは簡単だと言われている。', 'They say that while it is difﬁcult to enter a Japanese university, it is easy to graduate.')], 'Image Notes': 'https://postautistic.github.io/img/Advancedにひきかえ.png'}"
523,にいたっては,niitatteha,A compound particle that indicates an extreme example.When it comes to ~; as for; for example,entries/524.html,A. 384,"{'Explanation': 'No explanation available', 'Example Sentences': [('人間の体は60%が水、魚は75%、くらげにいたっては96%が水だ。', 'Human bodies are 60 percent water, while ﬁsh are 75 percent  water. As for jellyﬁsh, the ﬁgure is 96 percent.'), ('私自身は社会人になってからコンピュータを使い始めたが、新入社員は中学生の頃から、私の子供たちにいたっては、生まれた時から家にコンピュータがある世代だ。', 'I myself started to use a computer after I graduated and got a  job, but the new hires got started on computers when they were still junior  high school students. As for my children, they belong to the generation for  whom a computer is available at home from the time of their birth.'), ('一年間に日本中の廃棄物は5、１６０万トン、しかまこれは家庭や飲食店などから出る一般廃棄物で、産業廃棄物にいたってはその8倍近くの4億8百万トンも出ているのです。', 'In a year, 51,600,000 tons of waste is produced across Japan.  And, this is just general waste from homes and eating places. When it comes to  industrial waste, as much as 408,000,000 tons of waste, or nearly eight times  as much as general waste, is produced.'), ('少林寺拳法では女性拳士の数が増加傾向にあり、高校や大学の部活動にいたっては、部員の半数近くが女性だ。', 'In the case of Shourinji Kenpou, the number of female  practitioners is increasing; in clubs at high schools and colleges, for  example, almost half of the members are girls.'), ('今私たちの生活には多くの椅子が使われている。ダイニングにいたっては、ダイニングテーブルと椅子は、もはや一般的である。', 'Today we use many chairs in our daily life. As for the dining  room, a (set of) dining table and chairs is the standard.'), ('日本には、一般紙やスポーツ紙、専門的な業界紙など様々な新聞があるが、雑誌にいたっては、どんな分野のものでもある。', 'In Japan there are various newspapers, such as general papers,  sports newspapers, or papers that specialize in certain industries, but as for  magazines, they cover all ﬁelds.'), ('アジア太平洋地域以外にも、旅行者の注目を集めている地域がある。中央アメリカは昨年、旅行者数が23%増、中東も17.5％増となった。スペインも９％増加したし、モロッコにいたっては、２２％も増えた。', 'Areas outside the Asia Paciﬁc region have been drawing the  attention of travellers as well. Last year Central America saw a 23 percent  increase in travellers; in the Middle East, it was 17.5 percent. Spain saw 9  percent more travellers, and travel (literally: travellers) to Morocco, of all  places, grew 22 percent.')], 'Image Notes': 'https://postautistic.github.io/img/Advancedにいたっては.png'}"
