Index,Word,Romaji,Meaning,Page Link,Page Number,Detailed Info
0,あげる (1),ageru1,Someone gives something to a person who is not a member of the giver’s in group but whose status is about equal to that of the giver.Give,entries/1.html,B. 63,"{'Explanation': 'Spoiler English example sentencesSomeone gives something to a person who is not a member of the giver’s in group but whose status is about equal to that of the giver.Give', 'Example Sentences': [('私は良子に花をあげた・あげました。', 'I gave Yoshiko flowers.'), ('大野さんは山本さんに本をあげた。', 'Ms. Ono gave Mr. Yamamoto a book.'), ('君はアンに何をあげましたか。', 'What did you give to Ann?')], 'Image Notes': 'https://postautistic.github.io/img/Basicあげる1.png'}"
1,あげる (2),ageru2,Someone gives some action as a favour to a person who is not a member of the giver’s in group but whose status is about equal of the giver.Do something for someone; do someone a favour by doing something,entries/2.html,B. 65,"{'Explanation': 'Spoiler English example sentencesSomeone gives some action as a favour to a person who is not a member of the giver’s in group but whose status is about equal of the giver.Do something for someone; do someone a favour by doing something', 'Example Sentences': [('私は信男さんにネクタイを買ってあげた・あげました。', 'I bought a tie for Nobuo.'), ('僕は春子さんを慰めてあげた・あげました。', 'I consoled Haruko.'), ('君はお母さんに何をしてあげましたか。', 'What did you do for your mother?'), ('田中さんはスミスさんに本を貸してあげた。', 'Mr. Tanaka lent a book to Mr. Smith.')], 'Image Notes': 'https://postautistic.github.io/img/Basicあげる2.png'}"
2,間・あいだ(に),aidani,The space between two temporal or physical points.During (the time when); while,entries/3.html,B. 67,"{'Explanation': 'Spoiler English example sentencesThe space between two temporal or physical points.During (the time when); while', 'Example Sentences': [('私がご飯を食べている間山田さんはテレビを見ていた・いました。', 'While I was eating my meal, Mr Yamada was watching TV.'), ('私がご飯を食べている間に山田さんが来た・来ました。', 'While I was eating my meal, Mr. Yamada came in.'), ('スミスさんは日本にいる間英語を教えていました。', 'Mr. Smith was teaching English (all during the time) while he was in Japan.'), ('子供達がテルビを見ている間私は本を読んでいました。', 'I was reading a book (all during the time) while my children were watching TV.'), ('高橋さんはアメリカにいる間にゴルフを覚えました。', 'Mr. Takahashi learned golf while he was in America.'), ('中川さんのお母さんは中川さんがパリに留学している間に病気になりました。', ""Mr. Nakagawa's mother become ill while he was studying in Paris.""), ('秋子は子供がいない間に本を読む。', 'Akiko reads books while her children are not at home.')], 'Image Notes': 'https://postautistic.github.io/img/Basic間に.png'}"
3,あまり,amari,The degree of something is not great.(not) very much; (not) very,entries/4.html,B. 72,"{'Explanation': 'Spoiler English example sentencesThe degree of something is not great.(not) very much; (not) very', 'Example Sentences': [('この本はあまりよくない・よくありません。', 'This book is not very good.'), ('鈴木さんはあまり食べない。', 'Miss Suzuki does not eat much.'), ('私はあまり速く走れません。', 'I cannot run very fast.')], 'Image Notes': 'https://postautistic.github.io/img/Basicあまり.png'}"
4,ある (1),aru1,An inanimate thing exists.Be; exist; have,entries/5.html,B. 73,"{'Explanation': 'Spoiler English example sentencesAn inanimate thing exists.Be; exist; have', 'Example Sentences': [('この町（に）は大学が三つある・あります。', 'In this town are three universities.'), ('エッフェル塔はパリにある・あります。', 'The Eiffel Tower is in Paris.'), ('私のアパト(に)はテレビが二台ある。', 'There are two TV sets in my apartment.'), ('デトロイトはミシガン州にあります。', 'Detroit is in the State of Michigan.'), ('和田さんのうち(に)はクーラーがない。', ""There is no air-conditioner at Mr. Wada's."")], 'Image Notes': 'https://postautistic.github.io/img/Basicある1.png'}"
5,ある (2),aru2,Something has been done to something and the resultant state of that action remains.Have been done; be done,entries/6.html,B. 76,"{'Explanation': 'Spoiler English example sentencesSomething has been done to something and the resultant state of that action remains.Have been done; be done', 'Example Sentences': [('それはもうジョンに話してある・あります。', ""It's been told to John already.""), ('飲み物はもう買ってあります。', 'Drinks have already been bought.'), ('窓が開けてある。', 'The window has been open/is open.')], 'Image Notes': 'https://postautistic.github.io/img/Basicある2.png'}"
6,あとで,atode,Some state or action takes place at a time (not always immediately) after another state or action has taken place.After,entries/7.html,B. 78,"{'Explanation': 'Spoiler English example sentencesSome state or action takes place at a time (not always immediately) after another state or action has taken place.After', 'Example Sentences': [('メイソンさんは日本へ行ったあとで病気になった・なりました。', 'Mr. Mason became ill after he went to Japan.'), ('私は授業のあとで図書館に行った・行きました。', 'After the class I went to the library.'), ('ご飯を食べたあと（で）すぐ勉強しました。', 'I studied right after I had eaten my meal.'), ('山田さんはビールを飲んだあと（で）寝てしまった。', 'Mr. Yamada fell asleep after he drank beer.'), ('戦争が終わったあと（で）東京に戻りました。', 'I went back to tokyo after the war ended.'), ('食事のあとでテニスをした。', 'I played tennis after my meal.')], 'Image Notes': 'https://postautistic.github.io/img/Basicあとで.png'}"
7,ば,ba,A conjunction which indicates that the preceding clause expresses a conditional.If,entries/8.html,B. 81,"{'Explanation': 'Spoiler English example sentencesA conjunction which indicates that the preceding clause expresses a conditional.If', 'Example Sentences': [('この薬を飲めばよくなる・なります。', ""If you take this medicine, you'll get well.""), ('これは松本先生に聞けば分かります。', ""You'll understand it if you ask Professor Matsumoto.""), ('その町は車で行けば三十分で行ける。', 'You can get to that town in thirty minutes if you go by car.'), ('安ければ買います。', ""I'll buy it if it's cheap./I would buy it if were cheap.""), ('時間があれば京都へも行きたい。', 'If I have time, I want to go to Kyoto too./If I had time, I would want to go to Kyoto, too.'), ('見たければ見なさい。', 'If you want to see it, see it.'), ('出来ればこれもやってください。', 'Please do this, too, if you can.')], 'Image Notes': 'https://postautistic.github.io/img/Basicば.png'}"
8,ばかり,bakari,"A particle which indicates that something is the only thing or state which exists, or the action someone will take, takes, is taking or took.Only; just; be ready to do something; have just done something; just did something; be just doing something; about",entries/9.html,B. 84,"{'Explanation': 'Spoiler English example sentencesA particle which indicates that something is the only thing or state which exists, or the action someone will take, takes, is taking or took.Only; just; be ready to do something; have just done something; just did something; be just doing something; about', 'Example Sentences': [('デザートは食べるばかりになっている・います。', 'The only thing left to do with the dessert is to eat it./The dessert is ready to eat.'), ('友子は遊んでばかりいる・います。', 'The only thing Tomoko is doing is playing./Tomoko is doing nothing but playing.'), ('私は昼ご飯を食べたばかりだ・です。', ""I had my lunch and haven't done anything else since then./I have just eaten my lunch.""), ('このレストランは安いばかりだ・です。', 'The only merit of this restaurant is that the food is inexpensive./This restaurant is just cheap.'), ('デニスはビールばかり飲んでいる・います', 'Dennis is drinking only beer.'), ('私は一月ばかりパリにいた・いました。', 'I was in Paris for about a month.'), ('このレポートはあと結論を書くばかりだ。', 'The only thing left to do with this report is to write a conclusion.'), ('春江は泣いてばかりいて何も話そうとしない。', ""Harue is just crying and won't talk about anything.""), ('松山さんは今シカゴに着いたばかりです。', 'Mr. Matsuyama has just arrived in Chicago now.'), ('この仕事は面倒なばかりであまり儲かりません。', ""This job is troublesome and doesn't bring us big profits.""), ('この寮に住んでいるのは男子学生ばかりだ。', 'The students who are living in this dorm are all boys.'), ('フィッシャー先生はリサとばかり話している。', 'Professor Fisher is talking only with Lisa.'), ('十人ばかりの友達が手伝ってくれました。', 'About ten friends helped me.')], 'Image Notes': 'https://postautistic.github.io/img/Basicばかり.png'}"
9,ばよかった,bayokatta,A phrase which expresses the speaker’s regret.I wish ~ had done something,entries/10.html,B. 87,"{'Explanation': 'Spoiler English example sentencesA phrase which expresses the speaker’s regret.I wish ~ had done something', 'Example Sentences': [('先生に聞けばよかった・ばよかったです。', 'I wish I had asked my teacher.'), ('あの本を読めばよかった。', 'I wish I had read that book.'), ('ウェルズさんは日本へ行けばよかったね。', ""I wish Mr. Wells had gone to Japan, don't you?""), ('ああ、もっと英語を勉強しておけばよかったなあ。', 'Oh, I wish I had studied English harder!')], 'Image Notes': 'https://postautistic.github.io/img/Basicばよかった.png'}"
10,だい,dai,A sentence final particle which indicates an interrogative word question in informal male speech.,entries/11.html,B. 90,"{'Explanation': 'Spoiler English example sentencesA sentence final particle which indicates an interrogative word question in informal male speech.', 'Example Sentences': [('どこが静かだい。', 'What place is quiet?'), ('誰が行くんだい。', 'Who is going?'), ('新しい仕事はどうだい。', ""How's your new job""), ('あの人は誰だい。', 'Who is that person?'), ('何が可笑しいんだい。', ""What's funny?""), ('どの人は佐藤先生なんだい。', 'Which person is Professor Sato?')], 'Image Notes': 'https://postautistic.github.io/img/Basicだい.png'}"
11,だけ,dake,A particle which expresses a limit imposed upon something that is growing and expanding.Only; just; alone; merely; that’s all,entries/12.html,B. 93,"{'Explanation': 'Spoiler English example sentencesA particle which expresses a limit imposed upon something that is growing and expanding.Only; just; alone; merely; that’s all', 'Example Sentences': [('スミスさんだけ（が）来た・来ました。', 'Only Mr. Smith came.'), ('私は日本へ一度だけ行った・行きました。', 'I went to Japan only once.'), ('雪子さんとはデートしただけだ・です。', ""I just dated Yukiko, that's all.""), ('この家は大きいだけだ・です。', ""This house is big, that's all.""), ('このお菓子は色が奇麗なだけだ・です。', ""This cake has pretty colours, that's all.""), ('佐藤さんだけ（が）会議に出ました。', 'Only Mr. Sato attended the conference.'), ('小さい和英辞典だけ（を）買いました。', 'I bought only a small Japanese-English dictionary.'), ('僕にだけ・だけに話して下さい。', 'Please tell it only to me/to me alone.'), ('この車はアルコールでだけ・だけで動きます。', 'This car runs only on alcohol (and nothing else)/on alcohol alone (so it needs nothing else).'), ('あの先生には一度だけ会いました。', 'I met that professor only once.'), ('朝はコーヒーを一杯飲むだけです。', 'In the morning I just drink a cup of coffee, that’s all.'), ('この本は高いだけで面白くない。', 'This book is just expensive and is not interesting.'), ('テニスは好きなだけで上手じゃない。', 'I just like tennis, and I’m not good at it.'), ('それは学生だけのパーティーだった。', 'It was a party for students only.'), ('出来るだけゆっくり話して下さい。', 'Please speak slowly as possible.')], 'Image Notes': 'https://postautistic.github.io/img/Basicだけ.png'}"
12,だけで(は)なく～(も),dakedehanakumo,"Not only X but also Y, where X and Y can be either a noun, a verb, or an adjective.Not only ~ but also ~",entries/13.html,B. 97,"{'Explanation': 'Spoiler English example sentencesNot only X but also Y, where X and Y can be either a noun, a verb, or an adjective.Not only ~ but also ~', 'Example Sentences': [('あの人はよく勉強するだけで(は)なくよく遊ぶ・遊びます。', 'He not only studies hard, but also plays a lot.'), ('あの人は頭がいいだけで(は)なくよく勉強(も)する・します。', 'He is not only smart; he studies hard, too.'), ('このうちは奇麗なだけで(は)なくとても安い(です)。', 'This house is not only beautiful but it is also inexpensive.'), ('ジョンだけで(は)なくメアリーも来た・来ました。', 'Not only John but also Mary came here.'), ('あの人は小説を読むだけではなく書きます。', 'He not only reads novels but also writes them.'), ('ブラウンさんは日本へ行っただけではなく住んだこともあります。', 'Mr. Brown has not only been to Japan, but has lived there.'), ('このアパートは高いだけでなく大変狭いです。', 'This apartment is not only expensive but it is also very small.'), ('幸子は頭がよかっただけではなく、とても親切でした。', 'Sachiko was not only bright but also very kind.'), ('この車は奇麗なだけではなく、よく走ります。', 'This car is not only pretty but also runs well.'), ('日本人だけではなくアメリカ人もよく働きます。', 'Not only Japanese but Americans also work hard.'), ('中村さんはアメリカやヨーロッパだけではなく東南アジアにもよく出張します。', 'Mr. Nakamura makes a business trip not only to America and Europe but also to Southeast Asia.'), ('ジョンソンさんは日本語だけではなく中国語も話せます。', 'Mr. Johnson can speak not only Japanese but also Chinese.')], 'Image Notes': 'https://postautistic.github.io/img/Basicだけではなく～も.png'}"
13,だろう,darou,An auxiliary indicating the speaker’s conjecture which is not based on any particular information or evidence.Probably,entries/14.html,B. 100,"{'Explanation': 'Spoiler English example sentencesAn auxiliary indicating the speaker’s conjecture which is not based on any particular information or evidence.Probably', 'Example Sentences': [('アンダーソンさんは日本へ行くだろう・でしょう。', 'Ms. Anderson will probably go to Japan.'), ('あのアパートは高いでしょう。', 'That apartment is probably expensive.'), ('ロジャーはスキーが上手だろう。', 'Roger is probably good at skiing.'), ('あの人は中国人だろう。', 'That man is probably Chinese.')], 'Image Notes': 'https://postautistic.github.io/img/Basicだろう.png'}"
14,出す・だす,dasu,Something that has been latent is realised.Out; begin to; start to,entries/15.html,B. 102,"{'Explanation': 'Spoiler English example sentencesSomething that has been latent is realised.Out; begin to; start to', 'Example Sentences': [('車が動き出した・出しました。', 'The car started to move.'), ('急に雨が降り出した。', 'Suddenly it began to rain.'), ('一歳になって初めて歩き出した。', 'He started to walk only after he became a year old.'), ('そのアイディアは誰が考え出したんですか。', 'Who thought out that idea?'), ('一時間ぐらいかけてとうとうその本屋を探し出した。', 'After spending about an hour, I finally located that bookstore.')], 'Image Notes': 'https://postautistic.github.io/img/Basic出す.png'}"
15,で (1),de1,"A particle which indicates location, except for location of existence.At; in; on",entries/16.html,B. 105,"{'Explanation': 'Spoiler English example sentencesA particle which indicates location, except for location of existence.At; in; on', 'Example Sentences': [('私達は喫茶店でコーヒーを飲んだ・飲みました。', 'We drank coffee at a coffee shop.'), ('ゆり子はデパートで働いています。', 'Yuriko is working at a department store.'), ('オーストラリアでは十二月は夏だ。', 'In Australia it is summer in December.'), ('島崎さんは日本では元気でした。', 'Mr. Shimazaki was healthy in Japan.'), ('ヘレンは始めて舞台で歌った。', 'Helen sang on the stage for the first time.')], 'Image Notes': 'https://postautistic.github.io/img/Basicで.png'}"
16,で (2),de2,A particle which indicates the use of something for doing something.By; for; from; in; on; using; with,entries/17.html,B. 106,"{'Explanation': 'Spoiler English example sentencesA particle which indicates the use of something for doing something.By; for; from; in; on; using; with', 'Example Sentences': [('宮本さんは毎日バスで会社へ行く・行きます。', 'Mr. Miyamoto goes to his company by bus everyday.'), ('日本人は箸でご飯を食べる。', 'Japanese people eat rice with chopsticks.'), ('私達は日本語で話した。', 'We talked in Japanese.'), ('私はその映画をテレビで見ました。', 'I saw the movie on TV.'), ('豆腐は大豆で作ります。', 'We make toufu from soybeans.'), ('ラリーはこの椅子を十ドルで買った。', 'Larry bought this chair for ten dollars.'), ('ベッツィーはそのレポートを一日で書いたそうだ。', 'I heard that Betsy wrote the report in one day.')], 'Image Notes': 'https://postautistic.github.io/img/Basicで2.png'}"
17,で (3),de3,A particle (apparently derived from the て form of です) that indicates a weak causal relationship.And; because of; due to; because,entries/18.html,B. 107,"{'Explanation': 'Spoiler English example sentencesA particle (apparently derived from the て form of です) that indicates a weak causal relationship.And; because of; due to; because', 'Example Sentences': [('山口さんは病気で学校を休んだ・休みました。', ""Because Mr. Yamaguchi was ill, he didn't come to school.""), ('明日は期末試験で大変です。', ""I'm having an awful time because of tomorrow's final exam.""), ('大雨で橋が壊れた。', 'Heavy rain destroyed the bridge.'), ('昨日は夜、仕事でとても疲れた。', 'Because of my work I got very tired last night.'), ('父は交通事故で入院しました。', 'My father was hospitalised due to a traffic accident.')], 'Image Notes': 'https://postautistic.github.io/img/Basicで3.png'}"
18,で (4),de4,A particle which indicates the time when something terminates or the amount of time a period of activity has taken.At; on; in,entries/19.html,B. 109,"{'Explanation': 'Spoiler English example sentencesA particle which indicates the time when something terminates or the amount of time a period of activity has taken.At; on; in', 'Example Sentences': [('春学期は五月十日で終わる・終わります。', 'The spring term ends on May 10.'), ('このコンサートは十時で終わります。', ""This concert will be over at ten o'clock.""), ('私のパスポートは六月で切れる。', 'My passport expires in June.'), ('アメリカに来てから今日で三年になる。', ""It's been three years since I came to America."")], 'Image Notes': 'https://postautistic.github.io/img/Basicで4.png'}"
19,でも,demo,The て form of です plus も ‘even’.Even,entries/20.html,B. 111,"{'Explanation': 'Spoiler English example sentencesThe て form of です plus も ‘even’.Even', 'Example Sentences': [('先生でも間違う・間違います。', 'Even a teacher makes mistakes.'), ('私は難しい仕事でもする・します。', 'I will even do a difficult job.'), ('ここからでも富士山が見える・見えます。', 'Even from here you can see Mt. Fuji.'), ('子供でもそんなことは分かりますよ。', 'Even a child can understand that sort of thing.'), ('お会いしたいんですが、日曜日でも構いませんか。', ""I'd like to see you, but it is all right to see you even on Sunday?""), ('あの人は魚でも肉でも食べます。', 'He eats anything, whether it be fish or meat.')], 'Image Notes': 'https://postautistic.github.io/img/Basicでも.png'}"
20,どう,dou,An interrogative adverb which asks about the state of someone/something or the way of doing something.How; in what way,entries/21.html,B. 114,"{'Explanation': 'Spoiler English example sentencesAn interrogative adverb which asks about the state of someone/something or the way of doing something.How; in what way', 'Example Sentences': [('お母さんはどう（ですか）。', ""How's your mother?""), ('新しいアパートはどうですか。', ""How's your new apartment?""), ('コーヒーはどうですか。', 'How is the coffee?/Would you like coffee?/How about coffee?'), ('土曜日はどう？', 'How about Saturday?')], 'Image Notes': 'https://postautistic.github.io/img/Basicどう.png'}"
21,へ,he,A particle that indicates the direction toward which some directional movement or action proceeds.To; towards,entries/22.html,B. 116,"{'Explanation': 'Spoiler English example sentencesA particle that indicates the direction toward which some directional movement or action proceeds.To; towards', 'Example Sentences': [('私は先週京都へ旅行に行った・行きました。', 'I went on a trip to Kyoto last week.'), ('私は札幌のうちへ飛行機で帰った。', 'I went back home to Sapporo by plane.'), ('地震だったのでいそいで外へ出た。', 'It was an earthquake, so I went outside quickly.'), ('父へ手紙を出したが、まだ返事が来ない。', 'I sent a letter to my father, but his reply has not come yet.')], 'Image Notes': 'https://postautistic.github.io/img/Basicへ.png'}"
22,が (1),ga1,A particle which indicates the subject.,entries/23.html,B. 118,"{'Explanation': 'Spoiler English example sentencesA particle which indicates the subject.', 'Example Sentences': [('雨が降っている・います。', 'Rain is falling.'), ('私の部屋にはステレオがあります。', 'There is a stereo in my room.'), ('あ、のり子が走っている。', 'Oh, Noriko is running.'), ('A:このレストランは何が美味しいですか。B:ステーキが美味しいです。', 'A: What is good in this restaurant? B: Steak is good.')], 'Image Notes': 'https://postautistic.github.io/img/Basicが.png'}"
23,が (2),ga2,A disjunctive coordinate conjunction that combines two sentences.But,entries/24.html,B. 120,"{'Explanation': 'Spoiler English example sentencesA disjunctive coordinate conjunction that combines two sentences.But', 'Example Sentences': [('ジョンは来た・来ましたがメアリーは来なかった・来ませんでした。', ""John came but Mary didn't (come).""), ('私はビールは飲むが酒は飲まない。', ""I drink beer but don't drink sake.""), ('旅行をしたいがお金がない。', ""I want to travel but I don't have the money."")], 'Image Notes': 'https://postautistic.github.io/img/Basicが2.png'}"
24,がる,garu,An auxiliary verb attached to a psychological/physiological adjective meaning a person other than the speaker shows signs of ~Show signs of ~,entries/25.html,B. 123,"{'Explanation': 'Spoiler English example sentencesAn auxiliary verb attached to a psychological/physiological adjective meaning a person other than the speaker shows signs of ~Show signs of ~', 'Example Sentences': [('一男はスポーツカーを欲しがった・がりました。', 'Kazuo showed signs of wanting a sports car.'), ('上田さんはアイスクリームを食べたがった・がりました。', 'Mr Uedo showed signs of wanting to eat ice cream.'), ('スーザンは一人で淋しがっています。', 'Susan feels lonely by herself.'), ('子供が眠たがっている。', 'My child wants to go to sleep.')], 'Image Notes': 'https://postautistic.github.io/img/Basicがる.png'}"
