Index,Word,Romaji,Meaning,Page Link,Page Number,Detailed Info
245,結構,kekkou,An adverb that indicates that something exceeds the speaker's and/or hearer's expectation to a considerable degree.Quite; rather; pretty,entries/246.html,I. 123,"{'Explanation': 'No explanation available', 'Example Sentences': [('ここの寿司は、結構美味しいね。', ""The  sushi in this place is quite good, isn't it?""), ('この車は古いんだけど、結構よく走りますよ。', 'This  car is old, but it runs quite well, you know.'), ('あの人は間抜けに見えるでしょう。でも、結構頭がいいんです。', 'He  looks dumb, but he is quite sharp.'), ('四月だというのに、結構寒いね。', ""It  is April, but it is rather cold, isn't it?""), ('小さい町なのに、結構いいレストランがあるね。', ""There  are quite a few good restaurants in this small town, aren't there?""), ('この料理は量は少ないけど、結構胃にもたれるね。', 'This  dish is small in quantity, but it is pretty heavy on the stomach.'), ('今日は日曜日なのに高速が結構混んでいるね。', ""Today  is Sunday, but the highway is rather crowded, isn't it?""), ('父は楽天的な人でしたが、失職した時に結構悩んだようです。', 'My  father was an optimist, but when he lost his job, I think he suffered quite a  bit.'), ('カラオケは初めてだったが、結構楽しかった。', 'It  was my first karaoke, but it was rather enjoyable.')], 'Image Notes': 'https://postautistic.github.io/img/Intermediate結構.png'}"
246,この,kono,A demonstrative adjective which indicates a time or time period around the moment of speech.The last; this past; this; this coming,entries/247.html,I. 127,"{'Explanation': 'No explanation available', 'Example Sentences': [('秋山さんはこの春結婚します。', 'Miss  Akiyama will marry (this spring / this coming spring).'), ('山下君はこの一週間授業を休んでいます。', 'Yamashita  has been absent from class for the past (one) week.'), ('この間吉岡さんに会いました。', 'I  met Mr. Yoshioka the other day.'), ('このたびこの会の会員に加えていただきました。', 'I  became a member of this club at this time.'), ('この際車を買おうか。', 'Shall  we buy a car given this occasion?'), ('この辺で妥協したらどうですか。', ""Why  don't we compromise now (literally: around this time)?""), ('この夏は日本の女流作家の研究しています。', ""This  summer I'm doing research on Japanese female writers.""), ('この一週間は忙しくて何もできないだろう。', ""I'll  be busy this coming week and probably won't be able to do anything (else).""), ('この次はいつお目にかかれますか。', 'When  could I meet you next?')], 'Image Notes': 'https://postautistic.github.io/img/Intermediateこの.png'}"
247,こうした,koushita,A demonstrative which refers to someone or something mentioned as an example in previous discourse.Such; like this,entries/248.html,I. 130,"{'Explanation': 'No explanation available', 'Example Sentences': [('こうした問題はこの国では聞かれないようである。', 'We  do not seem to hear about problems like this in this country.'), ('こうした行為がどのような結果を招くかは誰の目にも明らかだ。', 'It  is clear to anyone what kind of result such behaviour brings about.'), ('こうした経験は日本へ行ったことのある者なら誰にでもあるはずだ。', 'Anyone  who has been to Japan would have had such an experience.'), ('私はこうした話には耳を貸さないことにしている。', 'I  make it a rule not to listen to such stories.')], 'Image Notes': 'https://postautistic.github.io/img/Intermediateこうした.png'}"
248,こそ,koso,"A particle which emphasizes a word, phrase, or clause.The very ~; it is ~; that ~; only (when, after, because, etc.); in particular; precisely; definitely; [an italicized or underlined word]",entries/249.html,I. 132,"{'Explanation': 'No explanation available', 'Example Sentences': [('これこそ我々が探し求めていたものだ。', ""This  is the very thing that we've been looking for.""), ('Ａ：どうもすみませんでした。     Ｂ：いいえ、こちらこそすみませんでした。', ""A:  I'm very sorry.           B: No, it's me  who should say that (literally: be sorry).""), ('一人でやってこそ勉強になるのだ。', 'You can learn something only when you do it by yourself.'), ('君が正直に話してくれたからこそ問題は最小で済んだんだ。', 'We could minimize the problem only because you explained \xa0(literally: told) it to us honestly.'), ('A: 一体一週間も何をしていたんだ。     B: そう言う君こそ何をしていたんだ。', 'A:  What on earth were you doing for a whole week?        B:  You say that but what were you doing?'), ('こんな時(に)こそ全員で力を合わせて問題を解決しなければならない。', 'On  this kind of occasion, in particular, we all have to cooperate in order to  solve the problem.'), ('今年こそこの試験に通ってみせる。', 'I will pass this exam definitely this year.'), ('それでこそ我々のリーダーだ。', 'That is precisely the kind of behaviour we expect from our leader.'), ('ここにいてこそいい仕事も見つかるのだ。', 'You can find a good job only by being here.'), ('親友だからこそこんなことまで君に言うんだよ。', ""It's because you are my friend that I can tell you (even) such a thing.""), ('出来ないからこそ人より余計に練習しなければならないのだ。', 'It’s precisely because you can’t do it that you have to practice more than others do.')], 'Image Notes': 'https://postautistic.github.io/img/Intermediateこそ.png'}"
249,こと,koto,An auxiliary noun to express a command.(don't) V; should (not); (not) ought to; may not,entries/250.html,I. 135,"{'Explanation': 'No explanation available', 'Example Sentences': [('発表は十五分以内で行うこと。', 'Each  presentation should be completed (literally: done) within fifteen minutes.'), ('プールサイドを走らないこと。', 'Do  not run on the pool deck.'), ('詳細は二十三ページ（を）参照のこと。', 'See  page 23 for details.'), ('私語は慎むこと。', 'Refrain  from whispering.'), ('先に必ずテープを聞くこと。', 'Be  sure to listen to the tape beforehand.'), ('辞書は見ないこと。', 'You  may not consult any dictionaries.'), ('裸足で歩き回らないこと。', 'Do  not walk around barefoot.'), ('弁当（を）持参のこと。', 'Bring  your own lunch.'), ('制服（を）着用のこと。', 'Wear  uniforms.')], 'Image Notes': 'https://postautistic.github.io/img/Intermediateこと.png'}"
250,ことで,kotode,A compound particle which indicates a means or a cause.By V-ing; because; result in; cause,entries/251.html,I. 137,"{'Explanation': 'No explanation available', 'Example Sentences': [('私は週末にゴルフをすることで気分転換を図っています。', 'I  try to lift my spirits by playing golf on weekends.'), ('彼が仲裁の場に出ていったことで事態は余計にこじれた。', 'His  appearance at the mediation scene complicated the situation even more.  (literally: The situation got even more complicated because he appeared at the  mediation scene.)'), ('私が十万円出すことで問題は解決した。', 'The  problem was solved by my paying 100,000 yen.'), ('彼女はものを言わないことで私へ精一杯の抵抗を示しているのです。', 'She  is demonstrating her utmost resistance to me by not talking.'), ('朝晩簡単な体操をするだけのことで素晴らしい健康が保てます。', 'You  can maintain wonderful health just by taking simple exercise in the morning and  evening.'), ('私が参加することであなたに迷惑はかかりませんか。', ""Wouldn't  my participation cause you trouble?""), ('彼のパーティーに行かなかったことで彼の気持ちを害したのでなければよいが。', ""I  hope I didn't hurt his feelings because I didn't go to his party (literally: by  not having gone to his party).""), ('私は英語が下手ことで時々損をしている。', 'I  am sometimes put at a disadvantage because I am poor at English.'), ('この国では外国人であることで得をすることがある。', 'In  this country there are times when you benefit for being a foreigner.')], 'Image Notes': 'https://postautistic.github.io/img/Intermediateことで.png'}"
251,ことになる,kotoninaru,A phrase which indicates that an action or event leads to a certain situation or logical conclusion.End up (with); cause; come to mean that,entries/252.html,I. 140,"{'Explanation': 'No explanation available', 'Example Sentences': [('これ以上聞くのは彼を余計に苦しめることになる。', 'Asking  more than this will cause him to suffer too much.'), ('今これをしておかなかったら後で大変なことになる。', ""If  we don't do this now, we will end up with an awful situation later.""), ('この手形が落ちなければ会社は倒産ということになる。', 'If  we cannot have this draft cashed, our company will end up in bankruptcy.'), ('こんな結果になったということは我々の準備に手落ちがあったことになる。', 'Ending  up with such a result means that there was something wrong with our  preparation.'), ('今回何も起こらなかったということはこのシステムで大丈夫だということになる。', 'The  fact that nothing happened this time means that the system is alright  (literally: the situation is alright with this system).'), ('今怠けていると試験の時ひどいことになるよ。', ""If  you don't work now, you'll end up with a terrible situation when you take the  exam.""), ('そんなことをしたら二度と人前に出られないことになる。', 'If  I / you do such a thing, I / you will end up not being able to appear in public  again.'), ('A社が百万円寄付してくれれば合計一千万円に達することになる。', 'If  Company A donates one million yen, the total sum will become (literally: end up  with) ten million yen.'), ('すべてがうまくいけば来年卒業ということになります。', 'If  everything goes well, (it means that) I will graduate next year.'), ('葉書が戻って来たということは彼はもうこの住所には住んでいないことになる。', ""That  the postcard came back means that he doesn't live at this address any longer.""), ('これが一キロ二千円ということはこちらの方が高いということになる。', 'That  this costs 2,000 yen a kilo means that this is more expensive.')], 'Image Notes': 'https://postautistic.github.io/img/Intermediateことになる.png'}"
252,ことによる,kotoniyoru,A phrase which is used to present an event as the cause of something.Be due to the fact that; be caused by; be brought about by; be the result of; because,entries/253.html,I. 143,"{'Explanation': 'No explanation available', 'Example Sentences': [('今回の失敗は事前の話し合いが不十分だったことによる。', 'The  failure this time is the result of insufficient discussion beforehand  (literally: due to the fact that the preceding discussion was insufficient).'), ('進が非行に走ったの両親の愛情が不足していたことによる。', ""Susumu's  delinquency was caused by his parents' lack of affection. (literally: The fact  that Susumu ran to juvenile delinquency is because his parents were not  affectionate enough with him.""), ('彼の現在の成功は平生の努力を怠らなかったことによる。', 'His  present success is due to the fact that he worked hard every day (literally:  did not neglect daily effort).'), ('彼らの離婚は二人の価値観があまりに違っていたことによる。', 'Their  divorce was caused by the fact that their value systems were very different.'), ('彼が負けたのは勝ちを焦りすぎたことによる。', 'His  loss is due to the fact that he tried to win quickly.'), ('彼の才能がこれ程までに開発されたのは鈴木氏に師事したことによる。', 'That  his talent was developed to this degree is due to the fact that he studied with  Mr. Suzuki.')], 'Image Notes': 'https://postautistic.github.io/img/Intermediateことによる.png'}"
253,ことはない,kotohanai,A phrase which expresses the idea that there is no need to do something or that there is no possibility of doing something.There is no need to; not necessary; there is no possibility that; there is no chance to,entries/254.html,I. 146,"{'Explanation': 'No explanation available', 'Example Sentences': [('あんな男の言うことを聞くことはない。', ""There's  no need to listen to a man like that.""), ('彼女が今日の会議を忘れることはないと思います。', ""I  think that there is no possibility that she will forget today's meeting.""), ('あんな奴に親切にしてやることはない。', 'There  is no need to be kind to a guy like that.'), ('何もそんなに慌てることはない。', 'There  is no need at all to be in such a hurry.'), ('君が来ることはないと思います。', ""1.  I don't think it will be necessary for you to come here. 2. I think that there is no possibility that you will come here.""), ('彼がわざわざ出て行くことはないでしょう。', '1.  There will probably be no need for him to take the trouble to go out there.       2. There is no possibility that he will  go out there.'), ('もうお目にかかることはないかもしれませんね。', 'I  might not have a chance to see you again.'), ('多分私が教えることはないと思います。', ""I  don't think there is a possibility that I will teach."")], 'Image Notes': 'https://postautistic.github.io/img/Intermediateことはない.png'}"
254,く,ku,A continuative form of an い-type adjective.And; so,entries/255.html,I. 148,"{'Explanation': 'No explanation available', 'Example Sentences': [('加奈子の性格は明るく、無邪気だった。', ""Kanako's  personality was cheerful and innocent.""), ('せっかく講演をしに行ったのに、聴衆が少なく、がっかりした。', 'I  went all the way to give a lecture, but the audience was so small that I felt  discouraged.'), ('カルフォルニアの空は青く、美しかった。', 'The  Californian sky was blue and beautiful.'), ('トムの東京のアパートの部屋は暗く、狭い。', ""Tom's  apartment room in Tokyo is dark and small.""), ('バッハの音楽は歯切れがよく、幾何学的だ。', ""Bach's  music is very crisp and geometrical.""), ('ニューヨークタイムズは質が高く、購読者の数も多い。', 'The  New York Times is high in quality and has many subscribers.'), ('世界の平和は得られにくく、維持しにくい。', 'World  peace is hard to achieve and hard to maintain.'), ('あの哲学者の思想は分かりやすく、文章も簡潔だ。', ""That  philosopher's ideas are easy to understand and his writing is simple, too.""), ('去年の冬は雪が多く、車の運転が大変だった。', 'Last  winter there was much snow and it was hard to drive around.'), ('私は失敗が恐ろしく、新しいことが何も出来ない。', ""I'm  afraid of failure, and I can't do anything new.""), ('洋子は一人でいるのが寂しく、最近猫を飼い始めた。', 'Yoko  felt lonely living alone, so she got a pet cat recently.')], 'Image Notes': 'https://postautistic.github.io/img/Intermediateく.png'}"
255,くらい,kurai,A particle which is used to express the degree of a state.To the extent that; so ~ that ~ (almost) ~; at least; the only ~; rather than ~,entries/256.html,I. 151,"{'Explanation': 'No explanation available', 'Example Sentences': [('私達は一歩も歩けないくらい疲れていた。', ""We  were so tired that we couldn't even take a step. (literally: We were tired to  the extent that we couldn't even walk one step.)""), ('今晩は暖かいのでストーブが要らないくらいだ。', ""It  is so warm this evening that we (almost) don't need a heater.""), ('山田さんくらいよく物を忘れる人はいない。', ""There's  no one who is as forgetful as Yamada (literally: who forgets things as much as  Yamada does).""), ('私は料理は下手ですが、ご飯くらい（は）炊けます。', 'I  am a poor cook (literally: bad at cooking), but I can at least cook rice.'), ('今この仕事が出来るのは彼くらいのものだ。', 'He  is the only person who can do this job now. (literally: The person who is  capable enough to do this job is he.)'), ('そんなことをするくらいなら死んだ方がましだ。', 'I  would rather die than do such a thing.'), ('その家は直しようがないくらい傷んでいた。', ""That  house was so damaged that it couldn't be repaired. (literally: That house was  damaged to the extent that it couldn't be repaired.)""), ('次郎はひどく酔っていて立っていられないくらいだった。', ""Jiro  was so drunk that he couldn't hold himself upright.""), ('こんな本、十ドルでもまだ高いくらいだ。', 'Even  ten dollars would still be too expensive for a book like this.'), ('内田さんくらいかわいそうな人はいない。', 'This  is no one who is as pitiful as Uchida.'), ('あの時くらい苦しかった時はない。', 'I  have never suffered as much as I did that time.'), ('信頼していた人に裏切られる（こと）くらい辛いことはない。', 'There  is nothing as painful as being betrayed by someone you have trusted.'), ('いくら安い所でもシャワーくらい付いているでしょう。', 'Even  though it is a cheap place, there should at least be a shower.'), ('そんな物に二万円も出すのはあなたくらいのものですよ。', 'You  are the only person who would pay as much as 20,000 yen for such a thing.'), ('あんな男の下で働くくらいなら乞食になった方がましだ。', 'I  would rather be a beggar than work under such a man.')], 'Image Notes': 'https://postautistic.github.io/img/Intermediateくらい.png'}"
256,くせに,kuseni,"A conjunction which expresses the speaker's contempt, anger, or disagreement about someone's action, behaviour, or state.Although; in spite of the fact that; and yet; but",entries/257.html,I. 155,"{'Explanation': 'No explanation available', 'Example Sentences': [('山田さんは日本人のくせにあまり漢字を知らない。', ""Although  Mr. Yamada is Japanese, he doesn't know many kanji.""), ('山内はよく知っているくせに何も教えてくれない。', ""In  spite of the fact that Yamauchi knows a lot about it, he doesn't tell me  anything.""), ('彼は大学生のくせに漫画ばかり読んでいる。', 'Although  he is a college student, all he does is read comics.'), ('良子はまだ学生のくせに高いマンションに住んでいる。', 'Although  Yoshiko is still a student, she lives in an expensive condominium.'), ('隆司は下手なくせに私とテニスをしたがる。', 'Takashi  is a bad (tennis) player, and yet he wants to play with me.'), ('怖いくせに無理するなよ。', ""You  are afraid. Don't pretend to be strong.""), ('孝男はお金もないくせに外車を欲しがっている。', ""Takao  doesn't have money, and yet he wants a foreign car.""), ('吉田は前は私を見ても挨拶もしなかったくせに、私が部長になった途端に急に愛想がよくなった。', 'Before  (the time I became a division chief), Yoshida never greeted me when he saw me, but he suddenly became friendly  when I became a division chief.'), ('昨日まで見習いだったくせに大きな口をきくな。', ""Don't  talk big! You were only a trainee until yesterday!"")], 'Image Notes': 'https://postautistic.github.io/img/Intermediateくせに.png'}"
257,までもない,mademonai,There is no point in going as far as to do something.Not necessary (to bother) to; do not need (to go as far as) to; do not have to,entries/258.html,I. 159,"{'Explanation': 'No explanation available', 'Example Sentences': [('これは簡単な計算だから計算器を使うまでもない。', 'This  is a simple calculation, so it is not necessary (to bother) to use a  calculator.'), ('言うまでもなくジョージ・ワシントンはアメリカの初代大統領だ。', 'Needless  to say, George Washington was the first president of the United States.'), ('彼がみんなに尊敬されたのは言うまでもない。', 'It  goes without saying that he was respected by everybody.'), ('大した用事じゃないからあなたがわざわざ行くまでもないでしょう。', 'It  is not important business, so it is probably not necessary for you to (take the  trouble to) get there.'), ('行けば分かることですから電話して聞くまでもありません。', ""We  can find out when we get there, so we don't need to call and about it.""), ('今更申すまでもありませんが、山中先生はこの分野では指導的な立場にあるお方です。', 'Needless  to say (now), Professor Yamanaka is a leading figure in this field.'), ('それは説明するまでもなく明らかなことだ。', 'It  is so obvious that no explanation is necessary.'), ('待つまでもなく妻は買い物から帰ってきた。', 'My  wife came back from shopping without my having to wait for her.')], 'Image Notes': 'https://postautistic.github.io/img/Intermediateまでもない.png'}"
258,まい,mai,An auxiliary which expresses the speaker's negative volition or conjecture.Will not; will probably not; be probably not,entries/259.html,I. 161,"{'Explanation': 'No explanation available', 'Example Sentences': [('もう橋本には何も頼むまい。', 'I  will not ask any more favours of Hashimoto.'), ('これは恐らく誰も気が付くまい。', 'Probably  no one will notice this.'), ('参加者はそれほど多くはあるまい。', ""There  probably won't be many participants.""), ('この教え方はあまり効果的ではあるまい。', 'This  teaching method is probably not very effective.'), ('これは何かの間違いではあるまいか。', 'I  have a feeling that this is some kind of mistake. (literally: Is this not some  kind of mistake?)'), ('清のパーティーにはもう行くまい。', ""I  will not go to Kiyoshi's parties any more.""), ('日本へ行こうか行くまいか迷った。', ""I  couldn't decide whether I should go to Japan or not.""), ('彼は多分誰の言うことも聞くまい。', ""He  probably won't listen to anyone.""), ('それは今我々には必要ではあるまい。', 'It  is probably not necessary for us now.'), ('この問題はこの学校の学生にはそれほど難しくはあるまい。', 'This  problem is probably not very difficult for these students.'), ('ジョージが真相を知っているのではあるまいか。', 'I  have a feeling that George knows the truth.')], 'Image Notes': 'https://postautistic.github.io/img/Intermediateまい.png'}"
