Index,Word,Romaji,Meaning,Page Link,Page Number,Detailed Info
402,あげく（に）,agekuni,An adverb/conjunction indicating that one spends an extended period of time before reaching a result.in the end; finally; eventually; after,entries/403.html,A. 7,"{'Explanation': 'No explanation available', 'Example Sentences': [('さんざん考えたあげく（に）大学院へ進学することにした。', 'After thinking for a long time, I decided to go on to graduate  school.'), ('彼女の離婚は数年悩んだあげくの決断だった。', 'Her divorce was a decision she made after agonizing for several  years.'), ('私はさんざん悩んだあげくに最初に勤めていた会社を辞めた。', 'I quit the company where I first worked after thinking very  hard (about what to do).'), ('彼はアジア、ヨーロッパ、北米などいろいろな国の女性とつき合ったあげくに、結局は生涯独身で過ごした', 'He dated women from various countries in Asia, Europe and North  America, but in the end he spent his entire life single.'), ('妻はあの靴がいい、この靴がいいと、いろいろと履いてみたあげくに、どれも買わずに店を出た。', 'Saying ""I like this one"" or ""I like that  one,"" my wife tried on all sorts of shoes, but after all that, she left  the store without buying any of them.'), ('山田は私の車を一か月も使ったあげく、返す時お礼の一言も言わなかった。', ""After using my car for a whole month, Yamada didn't even say a  word of thanks when he returned it.""), ('さんざん迷ったあげく、一年休職してアメリカに留学することにした。', 'After weighing my options for a long time, I finally decided to  take a one-year leave from my company to study abroad in the U.S.'), ('彼女は既婚の男性との恋に溺れたあげくに、自分の人生を台無しにしてしまった。', 'After falling in love with a married man, her own life was in  ruins.'), ('どのテレビを買おうかと迷ったあげく、何も買わずに帰ってしまった。', ""I couldn't decide which television I should buy, so (in the  end) I went home without buying any.""), ('彼が自殺したのはよくよく悩みぬいたあげくのことだったのであろう。', 'It must have been after really agonizing that he committed  suicide.'), ('無料のネットサービスには、登録時に住所、氏名、電話番号、生年月日、あげくの果てには学歴、年収、家族構成など、様々な個人情報を要求してくるものがある。', 'There are some free Internet services that require at the time  of registration your address, name, telephone number, date of birth, and at the  end, all sorts of personal information such as educational background, annual  income and family size, etc.')], 'Image Notes': 'https://postautistic.github.io/img/Advancedあげく(に).png'}"
403,あくまでも,akumademo,"An adverb that represents the idea of ""to the utmost degree"".to the end; persistently; insist; strictly; just; under any circumstance; absolutely; never; completely; ultimately",entries/404.html,A. 11,"{'Explanation': 'No explanation available', 'Example Sentences': [('江本氏はあくまでも自説を変えなかった。', ""Mr. Emoto persistently maintained (literally: didn't change)  his opinion.""), ('これはあくまでも小説であって実話ではない。', 'literally: This is strictly fiction and not a true story.'), ('彼女はあくまでも自分に正直だった。', 'She was true to herself to the end.'), ('私はあくまでも彼の無実を信じる。', 'I will believe in his innocence to the end.'), ('彼はあくまでも日本の参戦に反対を唱え続けた。', ""He kept opposing Japan's entry into the war up to the end.""), ('あくまで一人でやると言うのならあえて手助けはしない。', ""If you insist on doing it by yourself, I won't venture to  assist you.""), ('反乱軍はあくまでも抵抗を続けた。', 'The insurgent troops continued their resistance to the end.'), ('君がそういう風にあくまでも話し合いを拒否するのならこちらにも考えがある。', ""If you persistently refuse to have a discussion (with me) like  that, I'll make another plan.""), ('ケイトはあくまでも自分の外見にこだわった。', 'Kate was always particular about the way she looked.'), ('理論はあくまでも理論であって、現実がその通りになるという保証はどこにもない。', 'Theories are strictly theories; there is no guarantee that  reality turns out the way they predict.'), ('ここに書かれた費用はあくまでも目安であり、サービスによっては異なる場合があります。', 'The cost written here is strictly an estimate. It may differ  depending on the service (you choose).'), ('これはあくまでも私の直感なんですが、山田さんは近々この会社を辞めるんじゃないかと思います。', 'This is just what my sixth sense tells me, but I think Mr.  Yamada will quit this company soon.'), ('少しお金を貸していただきたいのですが、家族にはあくまで内緒にしていただきたいのです。', ""I'd like to borrow some money from you, but I'd appreciate it  if you would keep it absolutely secret from my family.""), ('空があくまでも青く澄みきっていた。', 'The sky was completely blue and clear.')], 'Image Notes': 'https://postautistic.github.io/img/Advancedあくまでも.png'}"
404,あながち～ない,anagachinai,A structure that indicates that something is not necessarily the way the speaker/writer thought.(not) necessarily; (not) always,entries/405.html,A. 14,"{'Explanation': 'No explanation available', 'Example Sentences': [('彼の推理もあながち間違っていないのかもしれない。', 'His guess may not necessarily be wrong.'), ('バーチャル指揮者ソフトが売れているところを見ると、一度は指揮者になってみたいというのは、あながち僕だけの願望ではないらしい。', ""Judging by how well virtual conducting software has been  selling, apparently I'm not necessarily the only one who'd like to try  orchestra conducting at least once in my life.""), ('最後の一章はやや蛇足とも思えるが、そのエピソードは読んでいて気分がいい。ということはあながち蛇足とは言えないということか。', ""I felt like the last chapter wasn't quite necessary, but it  feels good to read it. So, I guess it's not so superﬂuous after all.""), ('皮膚のpHが体調によっても変わるとすれば、「気分次第で色が変わる口紅」というのもあながち嘘ではない。', ""If it's true that the pH of your skin changes depending on your  health, then “the lipstick that changes its colour depending on your mood”  isn't necessarily a lie.""), ('完全に男女平等な社会が来るのは困るというのも、あながち偽った気持ちではない。', ""It wouldn't be a total lie for me to say I would have difﬁculty  with a society in which men and women are completely equal.""), ('この俳優の演技はうまいが、時々違和感を覚えるのは、あながち演出のせいとばかりは言えない。', ""This actor is talented, but sometimes his performances come off  a little strange, and I don't think it's necessarily always the fault of the  producer.""), ('生死の境をさまよっていた人が手術中の会話を鮮明に覚えていたりすることから、幽体離脱現象もあながち否定できない。', ""Since some people who've come close to dying say that they can  clearly recall what was being said around them while they were on the operating  table, we can't simply deny the occurrence of out-of-body experiences."")], 'Image Notes': 'https://postautistic.github.io/img/Advancedあながち～ない.png'}"
405,あるいは,aruiha,A conjunction that marks alternativesor; either ~ or; perhaps,entries/406.html,A. 16,"{'Explanation': 'No explanation available', 'Example Sentences': [('ボールペン(か)あるいは万年筆でお書き下さい。', 'Please write either with a ballpoint pen or a fountain pen.'), ('日本のような少子化社会では、大学の数を少なくするか、あるいは外国人の学生を増やすかしなければなるまい。', 'In a society like Japan where the number of children is  decreasing, we may have to either reduce the number of colleges or increase the  number of foreign students.'), ('性格が明るいか、あるいは暗いかによって、人生は非常に変わってくる。', ""Depending on whether someone's personality is cheerful or  gloomy, his or her life will change dramatically.""), ('すべての宗教は、あるいはアニミズムから来ている（の）かもしれない。', 'Perhaps all religions originate from animism.'), ('社長は朝ご飯にはトーストかあるいはオートミールを召し上がる。', 'For breakfast, the company president has either toast or  oatmeal.'), ('政治学あるいは経済学を専攻した学生を採用します。', 'We will hire a student who has majored in either political  science or economics.'), ('ご注文は電話か、あるいはインターネットでお願いします。', 'Please place your order either by phone or by Internet.'), ('この会社は大規模なリストラをするか、あるいは、倒産するかしかない。', 'The only choice left for this company is to execute a  large-scale restructuring or else go bankrupt.'), ('定年になったら毎日川で釣りをするか、あるいはゴルフをしようと思っています。', ""Once I retire, I'm thinking of ﬁshing at the river or playing  golf every day.""), ('人々の大統領の評価は好きか、あるいは、嫌いかのどちらかだ。', ""People's assessment of the president is split: They either love  him or hate him.""), ('現在日本の政党は乱立しているが、将来あるいはアメリカのように二大政党になるかもしれない。', 'Right now there are too many political parties in Japan, but in  the future, perhaps there will be two big parties like in the States.')], 'Image Notes': 'https://postautistic.github.io/img/Advancedあるいは.png'}"
406,あたかも,atakamo,An adverb used to present a counter-factual statement emphatically(just) as if ~ were; (just) as if ~ did ~; just like; just; exactly,entries/407.html,A. 21,"{'Explanation': 'No explanation available', 'Example Sentences': [('彼はあたかも責任者のように振る舞っている。', 'He behaves as if he were the person in charge.'), ('リニアモーターカーはあたかも氷の上をすべる（かの）ように走る。', 'The linear motor car runs as if it were gliding on ice.'), ('この装置を使って、あたかも現場にいる(かの)ような感覚で現場にいるロボットを操縦できる。', 'Using this device you can operate a robot at the site as if you  were actually there.'), ('この磁石はあたかも永久磁石のように動作する。', 'This magnet acts as if it were a permanent magnet.'), ('リモートコントロールソフトは遠くのPCのデスクトップ画面をそのまま手元のPCに映し出し、あたかも自分のデスクトップのように操作することができる。', ""A remote control software program displays the desktop of a remote  personal computer on the computer in front of you and enables you to operate it  as if it were your own computer's desktop.""), ('彼女はあたかも自分のうちにいるように振る舞っている。', 'She behaves as if she were in her own house.'), ('上手な説明文は、あたかも目の前にその光景が広がっているように鮮明にイメージできるものです。', 'With well-written explanatory sentences, the reader can get  vivid images, as if the scenes were spread out in front of his eyes.'), ('彼はあたかも自分が上司であるかのように私に仕事を言いつける。', 'He gives me assignments as if he were my boss.'), ('連結納税制度とは、企業グループがあたかも一つの法人であるかのように捉えて、納税させる仕組みです。', 'The linked tax payment system is a mechanism by which a group  of companies is viewed and made to pay taxes as if they were a single  corporation.'), ('この映画はコンピュータ・グラフィクスによって、あたかも人間が実際に人の体の中に入って活動しているような効果を生み出している。', ""Using computer graphics, this movie creates the effect of  people actually working and playing inside someone's body.""), ('私はあたかも空を飛んでいるかのような錯覚を覚えた。', 'I felt as if I were ﬂying (literally: I had the illusion of  ﬂying) through the air.'), ('この文章はあたかも我々が不正を行っているかのごとき印象を与える。', 'These sentences give people the impression that we are doing  something dishonest.')], 'Image Notes': 'https://postautistic.github.io/img/Advancedあたかも.png'}"
407,ばかりに,bakarini,A conjunction indicating that a single factor causes a negative situation.Simply because; just because; simply on account of ~,entries/408.html,A. 25,"{'Explanation': 'No explanation available', 'Example Sentences': [('僕が一言変なことを言ったばかりに彼女との関係は悪くなってしまった。', 'Just because I said one nasty thing to her, my relationship  with her deteriorated.'), ('あの子は、体が弱いばかりにクラスメートにいじめられている。', 'That child is being bullied by his classmates simply because he  is (physically) weak.'), ('あの日たまたま休んでいたばかりに、大事な連絡を聞きそびれた。', 'I missed a really important announcement just because I  happened to be absent that day.'), ('彼女が会いたいと言ってきた時に会いに行かなかったばかりに、それが最後のチャンスになってしまった。', ""Simply because I didn't go see her when she wanted to see me,  it turned out to be my last chance to see her.""), ('遺言がないばかりに相続人の間で遺産争いに発展するということがよくある。', 'Disputes among heirs over an inheritance often develop simply  because there is no will.'), ('お金がなかったばかりに、映画もろくに見られなかった。', ""I couldn't even go to the movies just because I didn't have any  money.""), ('医者の処置が不適切であったばかりに、助かる患者を死なせてしまった。', ""Simply because the doctor's treatment wasn't appropriate, the  patient, who could have been helped, lost his life.""), ('彼女は黒人女性であったばかりに人種差別と性差別を受けた。', 'She suffered from racial and sexual discrimination simply  because she was a black woman.'), ('姑との関係が悪いばかりに嫁はストレスが溜まり、よく病気になった。', 'Just because her relationship with her mother-in-law was so  bad, she often fell ill from the stress.'), ('両親が甘かったばかりに子供たちは自立心がない。', ""Those children don't have a sense of independence just because  they are spoiled so much by their parents.""), ('高校時代の教育がよくなかったばかりに、大学に入ってから苦労している。', ""I'm having a difﬁcult time in college all because my high  school education wasn't good."")], 'Image Notes': 'https://postautistic.github.io/img/Advancedばかりに.png'}"
408,ばこそ,bakoso,A conjunction that emphasizes a reasonit is precisely because ~ that ~; only because ~; to the extent that ~,entries/409.html,A. 27,"{'Explanation': 'No explanation available', 'Example Sentences': [('環境保護を支持していればこそ植林に力を入れているのだ。', 'It is only because I support environmental protection so much  that I put my efforts into planting trees.'), ('「愛」があればこそ生きる喜びがある。', 'Only because there is love is there joy for living.'), ('膨大な電力の需要があればこそ原子力発電を開発せざるを得ないのだ。', 'It is precisely because of the enormous demand for electricity  that we cannot help but develop atomic power plants.'), ('中近東の和平を熱望すればこそ、国連の役割を強化しなければならないと思う。', 'It is only because I hope for peace in the Middle East as much  as I do that I think we have to strengthen the role of the UN.'), ('親友であればこそ君にこんなにずけずけとものが言えるんだよ。', ""It is precisely because I'm your close friend that I can talk  straight to you like this.""), ('ビジョンを持った社長であればこそ社員は張り切って仕事をしているのだ。', 'It is precisely because he is a president with vision that his  employees are working with high spirits.'), ('人は一人でいるのが寂しければこそペットを飼うのだ。', 'To the extent a person feels lonely when he/she is alone,  he/she will keep a pet.'), ('言論が自由であればこそ民主主義は育っていくのである。', 'To the extent that there is freedom of speech, democracy will  keep growing.'), ('僕がこんなことを言うのも君を心配すればこそだ。', 'It is because I am really anxious about you that I am telling  you such a thing.')], 'Image Notes': 'https://postautistic.github.io/img/Advancedばこそ.png'}"
409,べからず・べからざる,bekarazubekarazaru,An auxiliary verb that indicates a strong prohibition.Shouldn’t; must not; ought not to ~; cannot; don’t ~,entries/410.html,A. 29,"{'Explanation': 'No explanation available', 'Example Sentences': [('芝生に入るべからず。', ""Keep off the lawn. (literally: Don't enter the lawn.)""), ('原子力はエネルギー源として欠くべからざるものとなっている。', 'Atomic energy has become indispensable as a source of energy.'), ('電車の中で携帯電話を使うべからず。', 'You ought not to use your cell phone in the train.'), ('ここで犬に糞をさせるべからず。', ""Don't let your dog go (to the bathroom) here.""), ('授業中に隣の者と私語をするべからず。', ""You shouldn't talk in class with your neighbours.""), ('無用の者、入るべからず。', ""No trespassing. (literally: Don't enter if you aren't on  business.)""), ('虚言を吐くべからず。', ""Don't tell a lie.""), ('インターネットを使う時の「べからず集」からいくつか引用してみよう。プライバシーを公開するべからず。怪しげなファイルに触れるべからず。インターネットの向こうに人間がいることを忘れるべからず。', ""Let me quote some of the Internet don'ts from this collection:  Don't make private matters public. Don't touch suspicious-looking files. Don't  forget that there are people on the other end of the Internet.""), ('彼は学生として許すべからざる行為を行ったとして大学を退学させられた。', 'He was expelled from college because he committed an  unpardonable act for a student.'), ('この世の中には批判すべからざる学説はほとんどないと言ってよいだろう。', 'One could say that there are very few theories we cannot  criticize.'), ('奇跡とは一言にしていえば、起こり得べからざる事実が起こる場合のことである。', 'In a nutshell, a miracle is when an utterly unexpected and  unlikely event happens.')], 'Image Notes': 'https://postautistic.github.io/img/Advancedべからず／べからざる.png'}"
410,べく,beku,"The verb modification form of the auxiliary bekida, which is used to indicate a purpose or aim.In order to; to; for the purpose of; for; so that ~ (can)",entries/411.html,A. 32,"{'Explanation': 'No explanation available', 'Example Sentences': [('この大学では、二学期制に変えるべく今準備が進められている。', 'At this university, preparation is under way for changing (the  current system) to a semester system.'), ('K社は人件費を削減すべく大規模なリストラを行う予定だ。', 'K Company plans to execute large-scale restructuring in order  to reduce personnel expenses.'), ('当社はいち早くお客さまの多様なニーズに対応すべく、最新の設備を導入してまいりました。', ""We (literally: our company) have installed the newest  facilities so that we can quickly respond to our customers' various needs.""), ('二児の母親ですが、現在フットセラピストとして独立すべく勉強中です。', 'I am a mother of two children and am currently studying to  start my own practice as a foot therapist (literally: to become independent as  a foot therapist).'), ('本学は、経済的な理由で大学教育を受けられない海外の優秀な学生にその機会を与えるべく、奨学金を供与している。', 'We (literally: our university) provide scholarships to give  educational opportunities to excellent students from overseas who cannot go on  to higher education for ﬁnancial reasons.'), ('重大な事故が発生した場合、お客様の安全確保を最優先として迅速な対応を行うべく、社内システムの見直しを行いました。', 'We have re-examined our internal systems so that we can rapidly  respond to major accidents in a manner that gives highest priority to customer  safety.'), ('より進んだ経営革新を行うためには、マネジメントシステム運用時の無駄を省くべく、システム間の重複をなくすことが重要である。', 'In order to engage in management innovation that is more advanced,  it is important to remove redundancy in management systems so that we can  eliminate unnecessary operations.')], 'Image Notes': 'https://postautistic.github.io/img/Advancedべく.png'}"
411,べくもない,bekumonai,A phrase meaning “it is impossible to do something”Impossible; there is no way for someone to ~; cannot be expected to,entries/412.html,A. 34,"{'Explanation': 'No explanation available', 'Example Sentences': [('私が一億円の家を買うなど、望むべくもない。', 'It is impossible for me to hope to buy a hundred million yen  house.'), ('十年前に別れた女性の居どころなど知るべくもない。', 'There is no way for me to know the whereabouts of the woman I  split up with 10 years ago.'), ('終戦後は海外旅行など望むべくもなかった。', 'In the post-war era, one could not even hope to make a trip  abroad.'), ('初日は雨で山頂は望むべくもなかったが、翌日はすっかり晴れ、白銀に輝く山は神々しい美しさだった。', 'On the ﬁrst day, it was impossible to view the summit because  of rain, but on the following day, the weather was perfect, and the mountain  was shining silvery white. It was sublimely beautiful.'), ('我々のような弱いチームが優勝候補のTチームに勝つべくもない。', 'A weak team like ours simply cannot be expected to beat Team T,  one of the competitors for the championship.'), ('その事件が起きた時私は海外旅行中で知るべくもなかった。', 'The incident occurred when I was traveling abroad, so there was  no way for me to know about it.'), ('最近は多忙で本を読む時間など期待すべくもない。', ""Lately I've been so busy that it is impossible to ﬁnd (literally:  to expect to have) time to read books."")], 'Image Notes': 'https://postautistic.github.io/img/Advancedべくもない.png'}"
412,べくして,bekushite,A phrase used when something occurs/occured exactly as expectedExactly as expected,entries/413.html,A. 36,"{'Explanation': 'No explanation available', 'Example Sentences': [('第二次世界大戦は起こるべくして起こった。', 'World War II occurred, exactly as expected.'), ('彼は大統領になるべくしてなった。', 'He became president, exactly as expected.'), ('真知子は高校の時から成績が抜群によく、東大に入るべくして入ったという感じである。', 'Machiko distinguished herself as an excellent academic achiever  in her high school days. As expected, she got into the University of Tokyo.'), ('二人は性格、趣味、学歴がすべて一致している。二人は結婚するべくして結婚したのだ。', 'Their personalities, hobbies and academic backgrounds match.  Just as (we) expected, those two got married.'), ('ゆみの運転はいつも荒っぽいし、エンジンもブレーキも調子が悪かった。事故は起こるべくして起こった。', ""Yumi's driving was always wild, and her car's engine and brakes  weren't in good condition. An accident occurred, exactly as expected.""), ('あの会社は経営がずさんだったから倒産するべくして倒産したのだ。', 'The management of the company has been so careless that it went  bankrupt, exactly as expected.'), ('私は自宅が海のすぐ近くのため、釣り好きになるべくしてなったと言っていいでしょう。', 'You could say that I became fond of ﬁshing, exactly as  expected, because my home is so close to the ocean.')], 'Image Notes': 'https://postautistic.github.io/img/Advancedべくして.png'}"
